{
  "$schema": "http://json-schema.org/draft-07/schema#",
  "$id": "validation-result.schema.json",
  "title": "Validation Results",
  "type": "object",
  "required": ["total", "passed", "failed", "results"],
  "properties": {
    "total": { "type": "integer", "minimum": 0 },
    "passed": { "type": "integer", "minimum": 0 },
    "failed": { "type": "integer", "minimum": 0 },
    "results": {
      "type": "array",
      "items": {
        "type": "object",
        "required": ["scenario_id", "passed"],
        "properties": {
          "scenario_id": { "type": "string" },
          "passed": { "type": "boolean" },
          "failure_stage": { "type": ["string", "null"] }
        }
      }
    }
  }
}
