{
  "total": 2,
  "passed": 2,
  "failed": 0,
  "results": [
    {
      "scenario_id": "diagram-diagram-converter",
      "passed": true,
      "failure_stage": null,
      "restore": {
        "operation": "restore",
        "success": true,
        "exit_code": 0,
        "duration_ms": 1732.5465679168701
      },
      "build": {
        "operation": "build",
        "success": true,
        "exit_code": 0,
        "duration_ms": 2130.356788635254
      },
      "run": {
        "operation": "run",
        "success": true,
        "exit_code": 0,
        "duration_ms": 3450.270891189575
      }
    },
    {
      "scenario_id": "diagram-pdf-converter",
      "passed": true,
      "failure_stage": null,
      "restore": {
        "operation": "restore",
        "success": true,
        "exit_code": 0,
        "duration_ms": 2724.1227626800537
      },
      "build": {
        "operation": "build",
        "success": true,
        "exit_code": 0,
        "duration_ms": 2777.385950088501
      },
      "run": {
        "operation": "run",
        "success": true,
        "exit_code": 0,
        "duration_ms": 4507.950067520142
      }
    }
  ]
}